<?xml version="1.0" encoding="UTF-8" ?>
<rule xmlns:xsi="http://www.w3.org/2001/XMLSchema-instance" xsi:noNamespaceSchemaLocation="../rulesSchema.xsd">
	<reference>
	    <reftype>RFC</reftype>
	    <refid>2083</refid>    
	    <specid>4.7</specid>
	    <spectitle>IDAT Chunk</spectitle>
	    <comment>
	    Validation of IDAT chunk 
	    </comment>
	</reference>
	<info>
	    <author>Georges-B. MICHEL</author>
	    <version>1.0</version>
	    <description></description>
	</info>
	<asserts>
		<ids>3</ids>
	    <assert>
	    	<id>1</id>
	        <struct start="0" endianess="big">@size:uint32::() / {'PLTE'} / [ [ @:uint8::(0>256) ;;; 3 ] ;;; ]</struct>
	        <message>Invalid IDAT Chunk format</message>  
	        <controllers>
	        	<control-true>
	        		<default>4.1</default>
	        	</control-true> 
	        	<control-false>
	        		<default>EXIT</default>
	        	</control-false>
	        </controllers>		   
	    </assert>
	</asserts>	
</rule>


