<?xml version="1.0" encoding="UTF-8" ?>
<rule xmlns:xsi="http://www.w3.org/2001/XMLSchema-instance" xsi:noNamespaceSchemaLocation="../rulesSchema.xsd">
	<reference>
	    <reftype>RFC</reftype>
	    <refid>2083</refid>    
	    <specid>12.11</specid>
	    <spectitle>Signature</spectitle>
	    <comment>
	    Validation of file's signature based on 8 firsts bytes    
	    </comment>
	</reference>
	<info>
	    <author>Georges-B. MICHEL</author>
	    <version>1.0</version>
	    <description></description>
	</info>
	<asserts>
		<ids>1</ids>
	    <assert>    
	    	<id>1</id>        
	        <struct start="0" endianess="big">{"89504e470d0a1a0ah"}</struct>
	        <message>Invalid signature</message>  
	        <controllers>
	        	<control-true>
	        		<default>2.1</default>
	        	</control-true> 
	        	<control-false>
	        		<default>EXIT</default>
	        	</control-false>
	        </controllers>	        
	    </assert>
	</asserts>
</rule>
