<?xml version="1.0" encoding="UTF-8" ?>
<rule xmlns:xsi="http://www.w3.org/2001/XMLSchema-instance" xsi:noNamespaceSchemaLocation="../rulesSchema.xsd">
	<reference>
	    <reftype>RFC</reftype>
	    <refid>2083</refid>    
	    <specid>4.1.4</specid>
	    <spectitle>IEND Chunk</spectitle>
	    <comment>
	    Validation of IEND chunk 
	    </comment>
	</reference>
	<info>
	    <author>Georges-B. MICHEL</author>
	    <version>1.0</version>
	    <description></description>
	</info>
	<asserts>
		<ids>4</ids>
	    <assert>
	    	<id>1</id>            
	        <struct start="-8" endianess="big">{'IEND'}</struct>
	        <message>Invalid IEND Chunk format</message>  
	        <controllers>
	        	<control-true>
	        		<default>END</default>
	        	</control-true> 
	        	<control-false>
	        		<default>EXIT</default>
	        	</control-false>
	        </controllers>	 
	    </assert>
	</asserts>
</rule>


